{
  "version": 1,
  "slug": "music-session-release-gates",
  "step": "committing",
  "phase_index": 3,
  "phase_count_hint": null,
  "rounds": {
    "plan_review": 1,
    "phase-01/code_review": 1,
    "phase-02/code_review": 2,
    "phase-03/code_review": 3
  },
  "vcs": "jj",
  "allow_dirty": true,
  "goal": "Finish the machine-local Effect TypeScript v4 music-session migration from the current dirty worktree. Preserve every verified commit, the accumulated packed-core harness, docs/music-session-architecture.html, and unrelated changes. Do not push or open a PR. The prior run was abandoned because its packed-core phase package was contradictory. Phase 1 must cover ONLY the installed packed-core Node daemon/client smoke and must explicitly adopt these achievable policies: keep the current package export surface; use a unique structurally supplied managed runtime path rather than requiring an unexported resolver; delete owned runtime artifacts after confirmed process termination; retain and report the temporary root when process-group termination cannot be confirmed rather than deleting beneath a possibly live process. Accept the existing passing installed smoke if it proves package-name imports, manifest-selected daemon, hello/replay, invalid config, disposal, bounded idle exit, provider isolation, and successful cleanup. Do not add unrelated acceptance. Then continue only the remaining exact OpenCode pin smoke, exact Pi smoke, docs/current architecture, full repository checks, mixed-host verification, and pr-description as narrow phases. Use Effect v4 only, jj squash workflow, Pi role profiles, regular panes, and preserve unrelated worktree changes.",
  "last_error": null,
  "pending_artifact": null,
  "pending_role": null,
  "pending_pane_id": null,
  "pending_pane_label": null,
  "pending_floating_exit": null,
  "pending_started_at": null,
  "pending_deadline_ms": null,
  "pending_nudged_at": null,
  "pending_final_grace": false,
  "pending_extended": false,
  "role_panes": {
    "planner": {
      "pane_id": "w2:pD8",
      "label": "apnea:planner:mswcsxkf-zpru"
    },
    "reviewer": {
      "pane_id": "w2:pDA",
      "label": "apnea:reviewer:mswcxyhm-nn12"
    },
    "coder": {
      "pane_id": "w2:pDB",
      "label": "apnea:coder:mswd12ne-pew0"
    }
  },
  "package_root": "/Users/nachovazquez/work/1-projects/naxodev/pi-apnea",
  "reviewer_tree_fingerprint": null,
  "current_phase_package": ".apnea/artifacts/phase-03/round-1/phase-package.md",
  "current_code_review": ".apnea/artifacts/phase-03/round-3/code-review.md"
}
